title,url,urltag,watchFor,incrementScrollByPX,totalScroll
YouChoose: Customize your Recommendations,https://www.youtube.com/watch?v=3laqegktOuQ,youchoose-recommendations,3s,400,1000
YouChoose.ai | Gain Control on your Recommendations!,https://www.youtube.com/watch?v=ReVMTcRA-E4,youchose-gain-Control,3s,400,1000
with Tracking Exposed: knowledge is freedom — algorithm analysis is for anybody!,https://www.youtube.com/watch?v=SmYuYEhT81c,trex-algorithm,5s,400,1000
How to Investigate TikTok’s Algorithm,https://www.youtube.com/watch?v=jpb83sxcDdI,trex-algorithm,15s,400,1000
Scopriamo Tracking.Exposed,https://www.youtube.com/watch?v=VKO9UXy-vlo,trex-alorihtm,15s,400,1000
facebook tracking exposed: come Facebook condiziona il nostro modo di vedere il mondo ,https://www.youtube.com/watch?v=vDzBNID4CjI,trex-alorihtm,15s,400,1000
