videoURL,title
https://www.youtube.com/watch?v=T_Kl5T1Ob6M,Explaining Sunrise & Sunset On Flat Earth
https://www.youtube.com/watch?v=WgLch-U4X1g,Peppa Pig Official Channel 🎵 Peppa Pig Finger Family Song@Peppa Pig - Nursery Rhymes and Kids Songs
https://www.youtube.com/watch?v=LjvBLBoY7Go,"EXTREME FISHING, SOUTHEAST ASIA."
https://www.youtube.com/watch?v=1sgrn4KzQGg,|Жизнь моря| 1 серия |Сериал| Gacha life|
https://www.youtube.com/watch?v=NZSY7PHGgwE,F*ck Censorship
https://www.youtube.com/watch?v=UGqcweY1a3I,Lord Christopher Monckton | Global Warming is a Hoax
https://www.youtube.com/watch?v=RkdbSxyXftc,What They Haven't Told You about Climate Change 
https://www.youtube.com/watch?v=4gznwiZzvkg,The Net The Unabomber LSD and the Internet 
https://www.youtube.com/watch?v=cK7R-IMTdVk,"The Net: The Unabomber, LSD and the Internet (subtitulado en español)"
https://www.youtube.com/watch?v=04MDYW1oEe0,UK: Hillary Clinton used destruction of Libya to run in election - Assange on emails
https://www.youtube.com/watch?v=nQN5gJ8sdBs,Marking the 10th anniversary of WikiLeaks' Cablegate publication
https://www.youtube.com/watch?v=hl4NlA97GeQ ,RAP NEWS | WikiLeaks: the truth is out there
https://www.youtube.com/watch?v=3adw9oLBkBI,RAP NEWS | WWWAR on the Internet
https://www.youtube.com/watch?v=IO9m6wZc-ps,VIDEO: YouTube senior software engineer: 'I escaped' active shooting situation
https://www.youtube.com/watch?v=71TIvHKfr4s,Google Whistleblower - Zach Vorhies - LIVE Interview
https://www.youtube.com/watch?v=g5p3s8DvUmE,Bill Ottman interviews Google Whistleblower Zach Vorhies
https://www.youtube.com/watch?v=3kQoKrlE9tI,Google Whistleblower Zach Vorhies Discusses “Google Leaks” with Gateway Pundit
https://www.youtube.com/watch?v=buYS1biprSs,"Google’s Power to Shift Elections—Zachary Vorhies, Greg Coppola and Dr. Robert Epstein"
https://www.youtube.com/watch?v=cC_mBru78F4,"Interview with Google Senior Software Engineer, Zach Vorhies"
https://www.youtube.com/watch?v=Clcx3jFa05c,Why You Suddenly Need To Delete Google Chrome | Straight Talking Cyber  | Forbes
https://www.youtube.com/watch?v=h-i011q1Ykg,Google grilled over alleged tax avoidance in UK
https://www.youtube.com/watch?v=96vnTLdSo4M,Google Finds Loopholes to Cut Taxes by $3.1 Billion: Video
https://www.youtube.com/watch?v=2uPoWfSHalk,Google Moves Billions Of Dollars To Bermuda In Tax Avoidance Strategy
